{"artifact_type":"access-ledger-entry","bindings":{"prospective_protocol_sha256":"254917b8a47a51f52d4af022dc7146a9f0755836242b1c491e6a0a583e0b8f73","simulation_implementation_sha256":"e2bde9347862ae4e13f89798ba2316368e1ea1acda14563008cbdecf42141c7d","simulation_population_sha256":"d6e0aa2b4a8a37c53b0b4f7296bc55cba234498aa2f4503b20b8edf6ecddf3b8","simulation_protocol_sha256":"c9c2b15361dd3a5f6284bc10972e2dc62e2ba2c8fcc19c55cc28475d441d2cc7","simulation_specification_sha256":"8077343f989caf30e01072ee5bd207bf60ec49eafe500b246f4fc3da83d046e4"},"evidence_classification":"simulated-development-only","human_independence":false,"payload":{"envelope_sha256":"33aa17fe6aaae1dc62ea5b0c9c520e863030e75700cb8a1cbc08a7a657b962f9","inputs":[{"kind":"frozen-rubric","sha256":"e99f026366798493f33d37e85af7f1e9c00cacef9b9898b964841deee01bad7a"},{"kind":"assigned-synthetic-fixture-material","sha256":"c7f45618e7ecedd6807c8a735ce5ab1956dccf35d609c21591879b531803bca5"}],"ledger_sequence":4,"persona_id":"SIM-LA","role_execution_sequence":7},"producer":"SIM-CE","prospective_protocol_activated":false,"release_authority":false,"schema":"kanon-v1.0.0-simulation-artifact-v1","sequence":7,"simulated_status":"simulated","simulation":true}
