{"artifact_type":"persona-handoff","bindings":{"prospective_protocol_sha256":"254917b8a47a51f52d4af022dc7146a9f0755836242b1c491e6a0a583e0b8f73","simulation_implementation_sha256":"e2bde9347862ae4e13f89798ba2316368e1ea1acda14563008cbdecf42141c7d","simulation_population_sha256":"d6e0aa2b4a8a37c53b0b4f7296bc55cba234498aa2f4503b20b8edf6ecddf3b8","simulation_protocol_sha256":"c9c2b15361dd3a5f6284bc10972e2dc62e2ba2c8fcc19c55cc28475d441d2cc7","simulation_specification_sha256":"8077343f989caf30e01072ee5bd207bf60ec49eafe500b246f4fc3da83d046e4"},"evidence_classification":"simulated-development-only","human_independence":false,"payload":{"classification":"simulated-development-only","consuming_persona":"SIM-CO","exact_input_commitments":["17794a16074fbd6cbc20092af26d31f3c6d292f5381e1a2138f3d516d6f9efe3"],"exact_output_commitment":"93da7da7ca89a373fdcf0c7db3139bafa6b0782236efa64d4c7d55ca26452a13","handoff_sequence":19,"lifecycle_sequence":18,"producing_persona":"SIM-RO","simulated":true},"producer":"SIM-RO","prospective_protocol_activated":false,"release_authority":false,"schema":"kanon-v1.0.0-simulation-artifact-v1","sequence":18,"simulated_status":"simulated","simulation":true}
