{"artifact_type":"persona-handoff","bindings":{"prospective_protocol_sha256":"254917b8a47a51f52d4af022dc7146a9f0755836242b1c491e6a0a583e0b8f73","simulation_implementation_sha256":"e2bde9347862ae4e13f89798ba2316368e1ea1acda14563008cbdecf42141c7d","simulation_population_sha256":"d6e0aa2b4a8a37c53b0b4f7296bc55cba234498aa2f4503b20b8edf6ecddf3b8","simulation_protocol_sha256":"c9c2b15361dd3a5f6284bc10972e2dc62e2ba2c8fcc19c55cc28475d441d2cc7","simulation_specification_sha256":"8077343f989caf30e01072ee5bd207bf60ec49eafe500b246f4fc3da83d046e4"},"evidence_classification":"simulated-development-only","human_independence":false,"payload":{"classification":"simulated-development-only","consuming_persona":"SIM-RO","exact_input_commitments":["53cdc7f9a998dc4c4fcfb4aa73dbb6dd8b38db3399024646c3b10fc793000742","5bd88e8b15e7a02667639257e610211bc546aa683b714a4f9014e021bcaff72a","1af353e250a18ed577d45840f47346b62ce00099b8e81d293e13665a56cbb71c","c11f2dcf3e50d38ed7de5dba15d5e1abbe532694015db8c109f791191b8bad07","df4f469611da4ce8ceb93a23119ed5d82d478649f76872c6937f9885a707e706","d6e23e3ce6595292862689772e266100228ae16af6261f778cfe11e0fcaf9a7f","c2ebfee777aa34d16ea97fc141a84a28a7b65d13e065dbab693ce9f3b4c414e8","163ff5d8683aed81c76093fc6658f9527228ae610abc427a278f082407da1326","6d28b171f767f80cff2d310e4b51fa233192cab64b956a053f83ae7be1e64b6b","5f660c085d8cb701385feab3a19748b9f45694b7d359097a75fad68d0f3e63f8","03bcf13f5f351e0f74d09c10d66dac1ddc8d672cb9d46209ab720d52448b41e2","26273fdd358bb59a6ad5e6f4d63c183b1d72e7e00bc2b16957ecae416185deaa","940e7447cbe33ac6da7391a12c0adcc8a4e8cf1f7e9584db0639112fb4c8f546","1857a9b70a2e99ec9e9717ae6050f62c6b437c1132b50433a15a987b1e584a96","b33855664cf5de2c8a02cd941797803cfb85b771478342f4ec82405f8c132a29","c5133fc34dcc3ede8e123d7622739b065f9d2eb42989ab8869d48d43d73ec730","daf7c1ba2599b1e931fbe6ad18c741c16026d4e43562f21dfa33a72ab81dee57","47894bd2dae1fd86efaf4e8d8e48b908fb00f781c52a317f0987a4a2e353d287","a5f517bbd315b65194dbac09ea483820af1a7c85be6d134aa5a5024687eb6cb3","f6b8627a911bbd9711a7421f2780af3fc2c68f9f016c17cdd83a89eb8715a000"],"exact_output_commitment":"f4219787221e1f810c894c05ad8ed047fca1a00f33830e712bd99fbeb0a29fe4","handoff_sequence":16,"lifecycle_sequence":15,"producing_persona":"SIM-CE","simulated":true},"producer":"SIM-CE","prospective_protocol_activated":false,"release_authority":false,"schema":"kanon-v1.0.0-simulation-artifact-v1","sequence":15,"simulated_status":"simulated","simulation":true}
