{"artifact_type":"fixture-prediction","bindings":{"prospective_protocol_sha256":"254917b8a47a51f52d4af022dc7146a9f0755836242b1c491e6a0a583e0b8f73","simulation_implementation_sha256":"e2bde9347862ae4e13f89798ba2316368e1ea1acda14563008cbdecf42141c7d","simulation_population_sha256":"d6e0aa2b4a8a37c53b0b4f7296bc55cba234498aa2f4503b20b8edf6ecddf3b8","simulation_protocol_sha256":"c9c2b15361dd3a5f6284bc10972e2dc62e2ba2c8fcc19c55cc28475d441d2cc7","simulation_specification_sha256":"8077343f989caf30e01072ee5bd207bf60ec49eafe500b246f4fc3da83d046e4"},"evidence_classification":"simulated-development-only","human_independence":false,"payload":{"candidate_source_commit":"af94bb2592e2646bbe6683511151f3e948bcfb55","concealed_case_id":"288ed95675fb65145e10f17fc6d94e2b310dec434af6e2196bc11b7cca8d61da","fixture_sha256":"0420f7b2edc21815c6b8366cc3f5b579321c650bc50c6099ba053ece3a41f83d","ordinal":5,"predictions":{"important_files":["README.md","pyproject.toml","tests/test_pipeline.py","src/data.py","src/pipeline.py"],"run":[],"test":[{"command":"pytest","cwd":"."}]},"processing_count":1},"producer":"SIM-CE","prospective_protocol_activated":false,"release_authority":false,"schema":"kanon-v1.0.0-simulation-artifact-v1","sequence":14,"simulated_status":"simulated","simulation":true}
