{"artifact_type":"deterministic-selection","bindings":{"prospective_protocol_sha256":"254917b8a47a51f52d4af022dc7146a9f0755836242b1c491e6a0a583e0b8f73","simulation_implementation_sha256":"e2bde9347862ae4e13f89798ba2316368e1ea1acda14563008cbdecf42141c7d","simulation_population_sha256":"d6e0aa2b4a8a37c53b0b4f7296bc55cba234498aa2f4503b20b8edf6ecddf3b8","simulation_protocol_sha256":"c9c2b15361dd3a5f6284bc10972e2dc62e2ba2c8fcc19c55cc28475d441d2cc7","simulation_specification_sha256":"8077343f989caf30e01072ee5bd207bf60ec49eafe500b246f4fc3da83d046e4"},"evidence_classification":"simulated-development-only","human_independence":false,"payload":{"combined_entropy_sha256":"1d70f503e2e8f3e43e1825dfe7a32db5e835effd295af722fb70b0c28cc65605","development":[{"case_reference":"sim-dev-svc-01","category":"service-layout","fixture_sha256":"46c88f54b890b1d7bf218c6a78cdcd5a5c685911d58c5100e6a95a55655234c4","rank_sha256":"3b3a465ab90baaa936dcd532146b874943e9c5624be20e66cae95b32c64048e1"},{"case_reference":"1bca79c4978d656161e5b5fd10a7fc110fd1e26cbb6666971efc1799a0fe4a00","category":"service-layout","fixture_sha256":"632ce396b4c84873b8e67f5917aa31faea7f72917db38723197edef2c3edfe85","rank_sha256":"487948403f935118e7110abbe155b0b9d66b2a77620598eff12e5d3a3aacad3b"},{"case_reference":"7d9cc5bbf83d7d852888c8cef29401d692e2c1d0068afcd07661f3390a737cbc","category":"workspace-layout","fixture_sha256":"f1968aba9fb813462d50ec1886a76ea8ebd4abc9a7c27c55258f13a54356d22a","rank_sha256":"1fdb9c9bf7f8fceb1cb4c1e22febf6856c2eb84216eb9e1ec319028683ffbf0e"},{"case_reference":"392e233bfbac3f227ea711559cf6439fda194558df10ebdbeefd3b7a77230bec","category":"workspace-layout","fixture_sha256":"4d187c4377bfdbdc8e5904e65274215c8c8e9d49c93c4a37b77855e2c74fd323","rank_sha256":"e630e20c7514a7ed1b20121957805244d2912b6604e99dfae11c6dfaa2c8ba55"},{"case_reference":"553ca7ae1ecccd62a5bada8485eca4125a3ca6b71f6eaf8a6aa49ce0e0b2b7c1","category":"model-layout","fixture_sha256":"f1e269bb27465ba116503244fb452a61cf5abe5d12fd82ad2ce77acfc8ffa884","rank_sha256":"0c73da9e8bccfc392a31ba92d205ae375ac8c24162c5e527dc2248389ad4f49c"},{"case_reference":"5c633f1f50fa3cae518e5c62cd578b24c5b20168a5e875c8885a9ce07599252e","category":"model-layout","fixture_sha256":"0ce1b4bce4c83f00d5fb133c1a2a71453ba4feecce0ef5041a5f946b4f537278","rank_sha256":"febc98cc81bcdac41af6618a13619da538cce091d46d5657ba025ad991080d5b"},{"case_reference":"6e59704e3d9e9b2d9ba405aab41ee6b5442cfd78c09af8ade8caaa156cc48139","category":"web-layout","fixture_sha256":"99d8d12454d38e1bb387dc07b42d4e74839c6cae570c5e5264a9a3f25c7b005a","rank_sha256":"6bf14291120aaad4a2c1ed7e0e0969b721c6a32f20ffc98b2c339035f1c887d2"},{"case_reference":"e67a5cd3aa332b293946c9fd51c1664ecfce9ef87ed5fb676a5a2f66e907e7d9","category":"web-layout","fixture_sha256":"4b3b55c92d406ca6cdf537fdb46aa770079b9a62d88ed7638692918e749a1d0e","rank_sha256":"6d73b9ce45ee3a14ddca09b8f6a0db60529bfe0bd61a700010fbc65ef4434433"},{"case_reference":"315016ba778de5df893e87ea58d61bf8dd8f92a78eeb3ffe0892a586f0b44fe2","category":"command-layout","fixture_sha256":"dda6f32e0a446b0f957428585ccf54e639816997a369629a7c3a89ce1ec3d1e0","rank_sha256":"1aa510e0b05a849ef4e32ace0f06b86539972ea900361494d063f310b13d2e4a"},{"case_reference":"ccac1d4e80a5648d402ed53e7274ece9cee00b031333ced6edbc7db1a13d1a88","category":"command-layout","fixture_sha256":"21333492e92ac7ddc4f22e8e42aef3c7f2b34e70b424f76bc8ec144db3ad53ce","rank_sha256":"2b152840f59afd2431eac8ef4b9c7bcfe79f201b4c9b579e53870780804b7eae"}],"development_count":10,"ordering":"ascending-hmac-sha256-within-category-and-partition","pseudo_holdout":[{"case_reference":"a22a5a0fc5fec72be5020d502510f9a60d5ea4fed31a68028f3dcbc5c4b68a6d","category":"service-layout","fixture_sha256":"bfa8581058eb48ce74533b95485e65cd38826a70e93470320ac52ee9d8971266","rank_sha256":"20259a3ae27c244b31313ca008f1ad936bc75958fcc1a84c841a78fda12fed7d"},{"case_reference":"b7acd08adc3caccf0bf51f6026e3b28a0fed6669132e3fd3c491b193128ef339","category":"service-layout","fixture_sha256":"d67490299acf7a74c8d29e3ced4cb3a46a946c763ebdb82009f0e94b6190ed11","rank_sha256":"9a0a130dafdd56321e2fb2abd8660a58e55765c2602a17a7d141cc4ebfc88228"},{"case_reference":"1e92b855804f6df897f67aa088bbb0d7404bea6953b685f9846ab4e624cfc509","category":"workspace-layout","fixture_sha256":"5c150b3ab95c016fdf4501807b266d802c4aab11ad29a08fd67f06f1442a2f63","rank_sha256":"6ccf11187a592571dd284f739976a4fe6c152bb7f411c54c6408169fa7fc331c"},{"case_reference":"2b9b2bfe539797011d45aa272469337c782cdec6394f569f7728c0113679e26e","category":"workspace-layout","fixture_sha256":"b14cc143f80646c4591382bd0ad13b212ff43299fb10f280b20b75732a10bd8f","rank_sha256":"d505df4b035073760b14ea16dca5635a3e01859a615514f884395035436b99e0"},{"case_reference":"288ed95675fb65145e10f17fc6d94e2b310dec434af6e2196bc11b7cca8d61da","category":"model-layout","fixture_sha256":"0420f7b2edc21815c6b8366cc3f5b579321c650bc50c6099ba053ece3a41f83d","rank_sha256":"41c089c9b1b036b46f3befbab9ec5c8d5d645460e0755af3dd19da5beff6bb3d"},{"case_reference":"5cb84c6259612369da58eebc5b2ffcd3824d970601bd7efe5b74b425bb68a725","category":"model-layout","fixture_sha256":"45d09c89e6133a52c1b84ab668fd3d14799327a5eca25e78b5e52a47038deb82","rank_sha256":"dfe99bd7ed030e8f633302dc5e1a7a18e0394f9530af65d029091c6d877df467"},{"case_reference":"9803fd1753bc813b485faba3fe7583e290f50e533f978914c41674710a35bdd7","category":"web-layout","fixture_sha256":"1f08ee4e89060e623523eec7f2982e1cf917ddae5b7ee74eb34d8a3e62aa624a","rank_sha256":"08a0abbd029097422ce661be06f257f81dee360d599e6721397103904dab4e4f"},{"case_reference":"0c2489f41a7447876ace6568fd024c4866c759f9d401a2b247b7d2807004eb0f","category":"web-layout","fixture_sha256":"8e246011137d3f62852a3371f71dadd2fddd70c48b1f44e1feaf0d3bc8d2e1ef","rank_sha256":"7a6ef682dbe2fc4cadd1ba15dd81dca35b5668b4231712aae172357da5b72ea5"},{"case_reference":"345951a465a263cf837f0ffe446ea44493731b53bc39a2d1b8070a5995eb7310","category":"command-layout","fixture_sha256":"00cef818d4d047da01e00d22b7a3293cc74d33cef4cf774cfafbe1da7501d1c3","rank_sha256":"6b0469fd44d05eb865f25c9d0e9569c39f1759692555462e750542391a71b2e3"},{"case_reference":"a8532afdf674a716a920cd1387c0299728d820b5c36f08fd24c5c79055b13ead","category":"command-layout","fixture_sha256":"42f13944a8191dbfec54b7a8b9544434df323739ac0d1e20df3aadbf682e0b91","rank_sha256":"cabc877bd6846b2ec0b658967b8784312b00ccf2d835ab7befed04c15e20ad44"}],"pseudo_holdout_count":10},"producer":"SIM-CE","prospective_protocol_activated":false,"release_authority":false,"schema":"kanon-v1.0.0-simulation-artifact-v1","sequence":5,"simulated_status":"simulated","simulation":true}
