{"artifact_type":"access-ledger-entry","bindings":{"prospective_protocol_sha256":"254917b8a47a51f52d4af022dc7146a9f0755836242b1c491e6a0a583e0b8f73","simulation_implementation_sha256":"e2bde9347862ae4e13f89798ba2316368e1ea1acda14563008cbdecf42141c7d","simulation_population_sha256":"d6e0aa2b4a8a37c53b0b4f7296bc55cba234498aa2f4503b20b8edf6ecddf3b8","simulation_protocol_sha256":"c9c2b15361dd3a5f6284bc10972e2dc62e2ba2c8fcc19c55cc28475d441d2cc7","simulation_specification_sha256":"8077343f989caf30e01072ee5bd207bf60ec49eafe500b246f4fc3da83d046e4"},"evidence_classification":"simulated-development-only","human_independence":false,"payload":{"envelope_sha256":"2ee43aba88ce335a7c621d5a289ca424c49fdf6eda9247f7c206ff30a6eb15a3","inputs":[{"kind":"simulation-specification","sha256":"8077343f989caf30e01072ee5bd207bf60ec49eafe500b246f4fc3da83d046e4"},{"kind":"synthetic-population","sha256":"809d040bdd2b38d21e00a061a093d207bb8fa94c3b617fdc83df921c9e13e01d"},{"kind":"concealed-pseudo-identities","sha256":"4d75fda94e44de49b011cd90342c9f7d8f14ac8723073d6ee46ced44a985cef9"},{"kind":"committed-entropy","sha256":"f94ead949b10723c799323f5f914be2c94dd536917672fb975937b40851d65ef"},{"kind":"fixture-generator","sha256":"e2bde9347862ae4e13f89798ba2316368e1ea1acda14563008cbdecf42141c7d"},{"kind":"frozen-candidate-after-freeze","sha256":"2de2a4298a2509cddf4de9c2d799f8b84cf3602c8c19bd8996994a3f3c54fac3"}],"ledger_sequence":8,"persona_id":"SIM-CE","role_execution_sequence":14},"producer":"SIM-CE","prospective_protocol_activated":false,"release_authority":false,"schema":"kanon-v1.0.0-simulation-artifact-v1","sequence":14,"simulated_status":"simulated","simulation":true}
