{"artifact_type":"persona-handoff","bindings":{"prospective_protocol_sha256":"254917b8a47a51f52d4af022dc7146a9f0755836242b1c491e6a0a583e0b8f73","simulation_implementation_sha256":"e2bde9347862ae4e13f89798ba2316368e1ea1acda14563008cbdecf42141c7d","simulation_population_sha256":"d6e0aa2b4a8a37c53b0b4f7296bc55cba234498aa2f4503b20b8edf6ecddf3b8","simulation_protocol_sha256":"c9c2b15361dd3a5f6284bc10972e2dc62e2ba2c8fcc19c55cc28475d441d2cc7","simulation_specification_sha256":"8077343f989caf30e01072ee5bd207bf60ec49eafe500b246f4fc3da83d046e4"},"evidence_classification":"simulated-development-only","human_independence":false,"payload":{"classification":"simulated-development-only","consuming_persona":"SIM-CE","exact_input_commitments":["e99f026366798493f33d37e85af7f1e9c00cacef9b9898b964841deee01bad7a","4d75fda94e44de49b011cd90342c9f7d8f14ac8723073d6ee46ced44a985cef9"],"exact_output_commitment":"94adbe33fe0edba0110cfbbfdd5ddc74e3869b1bf90dd75188df15d5b3fbd1a5","handoff_sequence":8,"lifecycle_sequence":7,"producing_persona":"SIM-LA","simulated":true},"producer":"SIM-LA","prospective_protocol_activated":false,"release_authority":false,"schema":"kanon-v1.0.0-simulation-artifact-v1","sequence":7,"simulated_status":"simulated","simulation":true}
