{"artifact_type":"access-envelope","bindings":{"prospective_protocol_sha256":"254917b8a47a51f52d4af022dc7146a9f0755836242b1c491e6a0a583e0b8f73","simulation_implementation_sha256":"e2bde9347862ae4e13f89798ba2316368e1ea1acda14563008cbdecf42141c7d","simulation_population_sha256":"d6e0aa2b4a8a37c53b0b4f7296bc55cba234498aa2f4503b20b8edf6ecddf3b8","simulation_protocol_sha256":"c9c2b15361dd3a5f6284bc10972e2dc62e2ba2c8fcc19c55cc28475d441d2cc7","simulation_specification_sha256":"8077343f989caf30e01072ee5bd207bf60ec49eafe500b246f4fc3da83d046e4"},"evidence_classification":"simulated-development-only","human_independence":false,"payload":{"envelope":{"forbidden_input_kinds":["concealed-pseudo-identities-before-freeze","pseudo-fixture-content-before-freeze","pseudo-labels-before-freeze","pseudo-predictions-before-freeze"],"human_independence":false,"permitted_input_kinds":["simulation-specification","synthetic-development-fixtures","baseline-source-commitment","baseline-artifact-commitment","public-validation-results"],"persona_id":"SIM-CO","procedural_only":true,"simulated":true},"envelope_sha256":"9f0a61f88674d0033d77c784e930fa169017cfc498d24a6c1d182657d6034681","hashed_before_role_execution":true},"producer":"SIM-CE","prospective_protocol_activated":false,"release_authority":false,"schema":"kanon-v1.0.0-simulation-artifact-v1","sequence":2,"simulated_status":"simulated","simulation":true}
