{"artifact_type":"raw-labels-b","bindings":{"prospective_protocol_sha256":"254917b8a47a51f52d4af022dc7146a9f0755836242b1c491e6a0a583e0b8f73","simulation_implementation_sha256":"e2bde9347862ae4e13f89798ba2316368e1ea1acda14563008cbdecf42141c7d","simulation_population_sha256":"d6e0aa2b4a8a37c53b0b4f7296bc55cba234498aa2f4503b20b8edf6ecddf3b8","simulation_protocol_sha256":"c9c2b15361dd3a5f6284bc10972e2dc62e2ba2c8fcc19c55cc28475d441d2cc7","simulation_specification_sha256":"8077343f989caf30e01072ee5bd207bf60ec49eafe500b246f4fc3da83d046e4"},"evidence_classification":"simulated-development-only","human_independence":false,"payload":{"cross_labeler_access":false,"labels":[{"category":"service-layout","concealed_case_id":"a22a5a0fc5fec72be5020d502510f9a60d5ea4fed31a68028f3dcbc5c4b68a6d","fixture_sha256":"bfa8581058eb48ce74533b95485e65cd38826a70e93470320ac52ee9d8971266","labels":{"important_files":["README.md","go.mod","cmd/service/main.go","internal/server/server.go","internal/transport/http.go"],"run":{"command":"go run ./cmd/service","cwd":"."},"status":"labelable","test":{"command":"go test ./...","cwd":"."}},"simulated_judgment":true},{"category":"service-layout","concealed_case_id":"b7acd08adc3caccf0bf51f6026e3b28a0fed6669132e3fd3c491b193128ef339","fixture_sha256":"d67490299acf7a74c8d29e3ced4cb3a46a946c763ebdb82009f0e94b6190ed11","labels":{"important_files":["README.md","go.mod","cmd/service/main.go","internal/server/server.go","internal/config/config.go"],"run":{"command":"go run ./cmd/service","cwd":"."},"status":"labelable","test":{"command":"go test ./...","cwd":"."}},"simulated_judgment":true},{"category":"workspace-layout","concealed_case_id":"1e92b855804f6df897f67aa088bbb0d7404bea6953b685f9846ab4e624cfc509","fixture_sha256":"5c150b3ab95c016fdf4501807b266d802c4aab11ad29a08fd67f06f1442a2f63","labels":{"important_files":["README.md","package.json","apps/console/main.js","packages/core/index.js","packages/config/index.js"],"run":{"command":"npm run start","cwd":"."},"status":"labelable","test":{"command":"npm test","cwd":"."}},"simulated_judgment":true},{"category":"workspace-layout","concealed_case_id":"2b9b2bfe539797011d45aa272469337c782cdec6394f569f7728c0113679e26e","fixture_sha256":"b14cc143f80646c4591382bd0ad13b212ff43299fb10f280b20b75732a10bd8f","labels":{"important_files":["README.md","package.json","apps/console/main.js","packages/core/index.js","packages/config/index.js"],"run":{"command":"npm run start","cwd":"."},"status":"labelable","test":{"command":"npm test","cwd":"."}},"simulated_judgment":true},{"category":"model-layout","concealed_case_id":"288ed95675fb65145e10f17fc6d94e2b310dec434af6e2196bc11b7cca8d61da","fixture_sha256":"0420f7b2edc21815c6b8366cc3f5b579321c650bc50c6099ba053ece3a41f83d","labels":{"important_files":["README.md","pyproject.toml","src/pipeline.py","src/model.py","src/data.py"],"run":{"command":"python -m src.pipeline","cwd":"."},"status":"labelable","test":{"command":"python -m pytest","cwd":"."}},"simulated_judgment":true},{"category":"model-layout","concealed_case_id":"5cb84c6259612369da58eebc5b2ffcd3824d970601bd7efe5b74b425bb68a725","fixture_sha256":"45d09c89e6133a52c1b84ab668fd3d14799327a5eca25e78b5e52a47038deb82","labels":{"important_files":["README.md","pyproject.toml","src/pipeline.py","src/model.py","src/data.py"],"run":{"command":"python -m src.pipeline","cwd":"."},"status":"labelable","test":{"command":"python -m pytest","cwd":"."}},"simulated_judgment":true},{"category":"web-layout","concealed_case_id":"9803fd1753bc813b485faba3fe7583e290f50e533f978914c41674710a35bdd7","fixture_sha256":"1f08ee4e89060e623523eec7f2982e1cf917ddae5b7ee74eb34d8a3e62aa624a","labels":{"important_files":["README.md","pyproject.toml","app/main.py","app/routes.py","app/service.py"],"run":{"command":"python -m app.main","cwd":"."},"status":"labelable","test":{"command":"python -m pytest","cwd":"."}},"simulated_judgment":true},{"category":"web-layout","concealed_case_id":"0c2489f41a7447876ace6568fd024c4866c759f9d401a2b247b7d2807004eb0f","fixture_sha256":"8e246011137d3f62852a3371f71dadd2fddd70c48b1f44e1feaf0d3bc8d2e1ef","labels":{"important_files":["README.md","pyproject.toml","app/main.py","app/routes.py","app/service.py"],"run":{"command":"python -m app.main","cwd":"."},"status":"labelable","test":{"command":"python -m pytest","cwd":"."}},"simulated_judgment":true},{"category":"command-layout","concealed_case_id":"345951a465a263cf837f0ffe446ea44493731b53bc39a2d1b8070a5995eb7310","fixture_sha256":"00cef818d4d047da01e00d22b7a3293cc74d33cef4cf774cfafbe1da7501d1c3","labels":{"important_files":["README.md","Cargo.toml","src/main.rs","src/lib.rs","src/args.rs"],"run":{"command":"cargo run","cwd":"."},"status":"labelable","test":{"command":"cargo test","cwd":"."}},"simulated_judgment":true},{"category":"command-layout","concealed_case_id":"a8532afdf674a716a920cd1387c0299728d820b5c36f08fd24c5c79055b13ead","fixture_sha256":"42f13944a8191dbfec54b7a8b9544434df323739ac0d1e20df3aadbf682e0b91","labels":{"important_files":["README.md","Cargo.toml","src/main.rs","src/lib.rs","src/args.rs"],"run":{"command":"cargo run","cwd":"."},"status":"labelable","test":{"command":"cargo test","cwd":"."}},"simulated_judgment":true}],"prediction_access":false,"raw_and_immutable":true},"producer":"SIM-LB","prospective_protocol_activated":false,"release_authority":false,"schema":"kanon-v1.0.0-simulation-artifact-v1","sequence":8,"simulated_status":"simulated","simulation":true}
