{"artifact_type":"persona-handoff","bindings":{"prospective_protocol_sha256":"254917b8a47a51f52d4af022dc7146a9f0755836242b1c491e6a0a583e0b8f73","simulation_implementation_sha256":"e2bde9347862ae4e13f89798ba2316368e1ea1acda14563008cbdecf42141c7d","simulation_population_sha256":"d6e0aa2b4a8a37c53b0b4f7296bc55cba234498aa2f4503b20b8edf6ecddf3b8","simulation_protocol_sha256":"c9c2b15361dd3a5f6284bc10972e2dc62e2ba2c8fcc19c55cc28475d441d2cc7","simulation_specification_sha256":"8077343f989caf30e01072ee5bd207bf60ec49eafe500b246f4fc3da83d046e4"},"evidence_classification":"simulated-development-only","human_independence":false,"payload":{"classification":"simulated-development-only","consuming_persona":"SIM-ADJ","exact_input_commitments":["8d909cb68d5d39e2bce3e7fba2e76071176f216b32312d3c8c52fcfed8957070","b8df7e008d7e98018a80c7a29080e4c0f6780ba10339a2822865392b9d856999","a7902dbb986e057459ab2944aa7a953bc5693496f0114fbcbbefdb20042c689b","3bb9c456e7fda286c6d9709297d1d79420b29a91a58b8b8ad5c0c896d9e37858"],"exact_output_commitment":"db983c67d970e2509efd90a5e7bece195de325386bfe43bd93d37dfd07203bd7","handoff_sequence":6,"lifecycle_sequence":5,"producing_persona":"SIM-CE","simulated":true},"producer":"SIM-CE","prospective_protocol_activated":false,"release_authority":false,"schema":"kanon-v1.0.0-simulation-artifact-v1","sequence":5,"simulated_status":"simulated","simulation":true}
