{"artifact_type":"prediction-blind-adjudication","bindings":{"prospective_protocol_sha256":"254917b8a47a51f52d4af022dc7146a9f0755836242b1c491e6a0a583e0b8f73","simulation_implementation_sha256":"e2bde9347862ae4e13f89798ba2316368e1ea1acda14563008cbdecf42141c7d","simulation_population_sha256":"d6e0aa2b4a8a37c53b0b4f7296bc55cba234498aa2f4503b20b8edf6ecddf3b8","simulation_protocol_sha256":"c9c2b15361dd3a5f6284bc10972e2dc62e2ba2c8fcc19c55cc28475d441d2cc7","simulation_specification_sha256":"8077343f989caf30e01072ee5bd207bf60ec49eafe500b246f4fc3da83d046e4"},"evidence_classification":"simulated-development-only","human_independence":false,"payload":{"disagreements":[{"case_id":"a22a5a0fc5fec72be5020d502510f9a60d5ea4fed31a68028f3dcbc5c4b68a6d","decision":"accept-label-a-as-rubric-consistent","field":"important_files","label_a":["README.md","go.mod","cmd/service/main.go","internal/server/server.go","internal/config/config.go"],"label_b":["README.md","go.mod","cmd/service/main.go","internal/server/server.go","internal/transport/http.go"],"prediction_access":false}],"prediction_access":false,"raw_labels_a_sha256":"6eff5f5c8b07aa3bacfde76cfac1001aff49800e56fafac9f56aabb3f2b94506","raw_labels_b_sha256":"68d35c0174c29901edb17b2ee462286889cdb005000586284d0ece328a76125e"},"producer":"SIM-ADJ","prospective_protocol_activated":false,"release_authority":false,"schema":"kanon-v1.0.0-simulation-artifact-v1","sequence":10,"simulated_status":"simulated","simulation":true}
