{"artifact_type":"candidate-freeze","bindings":{"prospective_protocol_sha256":"254917b8a47a51f52d4af022dc7146a9f0755836242b1c491e6a0a583e0b8f73","simulation_implementation_sha256":"e2bde9347862ae4e13f89798ba2316368e1ea1acda14563008cbdecf42141c7d","simulation_population_sha256":"d6e0aa2b4a8a37c53b0b4f7296bc55cba234498aa2f4503b20b8edf6ecddf3b8","simulation_protocol_sha256":"c9c2b15361dd3a5f6284bc10972e2dc62e2ba2c8fcc19c55cc28475d441d2cc7","simulation_specification_sha256":"8077343f989caf30e01072ee5bd207bf60ec49eafe500b246f4fc3da83d046e4"},"evidence_classification":"simulated-development-only","human_independence":false,"payload":{"candidate":{"complete_test_tree_sha256":"38ba14dfa8393e63b7bb54fe487285833b081a41ccccee860261d2207a4c511c","dependency_lock_sha256":"d540c58992283c0773d5e4c74590085678dfab798a5bbafcb93593c656ac89cc","generated_tree_sha256":"4614cfa25432eff928b95012b6ecab1d5bf2644a41631250cdb035568125609f","package_version":"0.4.0-rc.1","production_artifact_sha256":"0f87af4dfd851c268891c96237accf20b5089b0e0b95e10ac1417efebcca83a9","production_change_allowed":false,"production_source_tree_sha256":"42858661e59e1421fcc08df8f7c67dd86cbf83d66907853c39d5f3a82288949f","public_capabilities_sha256":"bfc00d445cc480389559fd8c115a6ae2607dd6b7241dd0e256565bde5f0256cf","relevant_files":[{"path":"eval/v1.0.0-prospective/evidence.schema.json","sha256":"020e0aee6254aa936fb3b91f723089a602ea41c23be35caef55e6c96bf04ab40"},{"path":"eval/v1.0.0-prospective/protocol.schema.json","sha256":"a0b58a9ffc512dcc62c32d45f5a54530025fe43326fb2a831f92997b2727b159"},{"path":"eval/v1.0.0-simulation/artifact.schema.json","sha256":"ba52e35606e972a4e3cb4712d144b42596d4fe6ae5aded1e52c01c08d941225f"},{"path":"eval/v1.0.0-simulation/protocol.schema.json","sha256":"af1070a9b632672b244610aa618560b64e1ff4807f0013853cf53ced8f2543b8"},{"path":"eval/v1.0.0-simulation/lib/fixtures.js","sha256":"b7eb40594d5dbe4a84093fbc0d6e417817b5fecbe58fb0085a519d180d353c81"},{"path":"eval/v1.0.0-simulation/lib/tabletop.js","sha256":"0c062421e1773b65c72f87a8fdd26276f1801a3d1db59f70c23e70025885e2fb"},{"path":"eval/v1.0.0-simulation/lib/validator.js","sha256":"fd512478e4ec57edcd25fdb0a76cc1be5e2f5f8f99df4993b83c38ffb32cf268"},{"path":"scripts/lib/v1-prospective-release.js","sha256":"2dfd94ca7f5980fbb92c44db61f58ee5cacbe7d3f9f6eefc23315df6fae1b40c"},{"path":"src/analyze.js","sha256":"f4ffc46af7f78aa331f5b9c2653035726ec6b599972b23f973adcc5f7ea330d0"},{"path":"test/v1-prospective-release.test.js","sha256":"71f58de751b0fcc1f30016dd85548a72032b92a3ca627af62793567864bf42ca"},{"path":"test/v1-simulation.test.js","sha256":"2e1ed0278a7d1fbcc082e416ad7b1b3d1611d839a176116e1aea6a0af1faf59d"}],"runtime_dependency_count":0,"source_commit":"af94bb2592e2646bbe6683511151f3e948bcfb55","validation_record_sha256":"94466882d47cf71c02ec576d93a8bab9549c9cbf83bcaed1c8eb588997134449"},"candidate_correction_created":false,"frozen_after_final_labels":true,"pseudo_holdout_disclosed_to_candidate_owner_before_freeze":false,"validation_summary":{"focused_simulation_tests":{"failed":0,"passed":22,"skipped":0},"implementation_commit":"af94bb2592e2646bbe6683511151f3e948bcfb55","simulation_only":true}},"producer":"SIM-CO","prospective_protocol_activated":false,"release_authority":false,"schema":"kanon-v1.0.0-simulation-artifact-v1","sequence":12,"simulated_status":"simulated","simulation":true}
