{"artifact_type":"persona-handoff","bindings":{"prospective_protocol_sha256":"254917b8a47a51f52d4af022dc7146a9f0755836242b1c491e6a0a583e0b8f73","simulation_implementation_sha256":"e2bde9347862ae4e13f89798ba2316368e1ea1acda14563008cbdecf42141c7d","simulation_population_sha256":"d6e0aa2b4a8a37c53b0b4f7296bc55cba234498aa2f4503b20b8edf6ecddf3b8","simulation_protocol_sha256":"c9c2b15361dd3a5f6284bc10972e2dc62e2ba2c8fcc19c55cc28475d441d2cc7","simulation_specification_sha256":"8077343f989caf30e01072ee5bd207bf60ec49eafe500b246f4fc3da83d046e4"},"evidence_classification":"simulated-development-only","human_independence":false,"payload":{"classification":"simulated-development-only","consuming_persona":"SIM-CE","exact_input_commitments":["0d0696e6f87b5727c0d9e22415571e904e5ef8626663841ff36da2d231a924a8","e99f026366798493f33d37e85af7f1e9c00cacef9b9898b964841deee01bad7a"],"exact_output_commitment":"03cc1e887fb52a4a27ff694eaea3e623118aa5461b6340dd7e772890aab49186","handoff_sequence":11,"lifecycle_sequence":10,"producing_persona":"SIM-ADJ","simulated":true},"producer":"SIM-ADJ","prospective_protocol_activated":false,"release_authority":false,"schema":"kanon-v1.0.0-simulation-artifact-v1","sequence":10,"simulated_status":"simulated","simulation":true}
