{"artifact_type":"simulated-prediction-unblinding","bindings":{"prospective_protocol_sha256":"254917b8a47a51f52d4af022dc7146a9f0755836242b1c491e6a0a583e0b8f73","simulation_implementation_sha256":"e2bde9347862ae4e13f89798ba2316368e1ea1acda14563008cbdecf42141c7d","simulation_population_sha256":"d6e0aa2b4a8a37c53b0b4f7296bc55cba234498aa2f4503b20b8edf6ecddf3b8","simulation_protocol_sha256":"c9c2b15361dd3a5f6284bc10972e2dc62e2ba2c8fcc19c55cc28475d441d2cc7","simulation_specification_sha256":"8077343f989caf30e01072ee5bd207bf60ec49eafe500b246f4fc3da83d046e4"},"evidence_classification":"simulated-development-only","human_independence":false,"payload":{"mapping":[{"concealed_case_id":"a22a5a0fc5fec72be5020d502510f9a60d5ea4fed31a68028f3dcbc5c4b68a6d","synthetic_case_id":"sim-pseudo-svc-01"},{"concealed_case_id":"b7acd08adc3caccf0bf51f6026e3b28a0fed6669132e3fd3c491b193128ef339","synthetic_case_id":"sim-pseudo-svc-02"},{"concealed_case_id":"1e92b855804f6df897f67aa088bbb0d7404bea6953b685f9846ab4e624cfc509","synthetic_case_id":"sim-pseudo-wsp-02"},{"concealed_case_id":"2b9b2bfe539797011d45aa272469337c782cdec6394f569f7728c0113679e26e","synthetic_case_id":"sim-pseudo-wsp-01"},{"concealed_case_id":"288ed95675fb65145e10f17fc6d94e2b310dec434af6e2196bc11b7cca8d61da","synthetic_case_id":"sim-pseudo-mdl-01"},{"concealed_case_id":"5cb84c6259612369da58eebc5b2ffcd3824d970601bd7efe5b74b425bb68a725","synthetic_case_id":"sim-pseudo-mdl-02"},{"concealed_case_id":"9803fd1753bc813b485faba3fe7583e290f50e533f978914c41674710a35bdd7","synthetic_case_id":"sim-pseudo-web-02"},{"concealed_case_id":"0c2489f41a7447876ace6568fd024c4866c759f9d401a2b247b7d2807004eb0f","synthetic_case_id":"sim-pseudo-web-01"},{"concealed_case_id":"345951a465a263cf837f0ffe446ea44493731b53bc39a2d1b8070a5995eb7310","synthetic_case_id":"sim-pseudo-cmd-01"},{"concealed_case_id":"a8532afdf674a716a920cd1387c0299728d820b5c36f08fd24c5c79055b13ead","synthetic_case_id":"sim-pseudo-cmd-02"}],"occurred_after_final_labels":true,"procedural_only":true,"real_blindness_proof":false},"producer":"SIM-CE","prospective_protocol_activated":false,"release_authority":false,"schema":"kanon-v1.0.0-simulation-artifact-v1","sequence":16,"simulated_status":"simulated","simulation":true}
