{"artifact_type":"synthetic-population-commitment","bindings":{"prospective_protocol_sha256":"254917b8a47a51f52d4af022dc7146a9f0755836242b1c491e6a0a583e0b8f73","simulation_implementation_sha256":"e2bde9347862ae4e13f89798ba2316368e1ea1acda14563008cbdecf42141c7d","simulation_population_sha256":"d6e0aa2b4a8a37c53b0b4f7296bc55cba234498aa2f4503b20b8edf6ecddf3b8","simulation_protocol_sha256":"c9c2b15361dd3a5f6284bc10972e2dc62e2ba2c8fcc19c55cc28475d441d2cc7","simulation_specification_sha256":"8077343f989caf30e01072ee5bd207bf60ec49eafe500b246f4fc3da83d046e4"},"evidence_classification":"simulated-development-only","human_independence":false,"payload":{"cases":[{"case_reference":"sim-dev-svc-01","category":"service-layout","fixture_sha256":"46c88f54b890b1d7bf218c6a78cdcd5a5c685911d58c5100e6a95a55655234c4","partition":"synthetic-development","real_repository":false,"synthetic_identity":"562426296c1906a64763e1216595846e4224056cf10f07d0bc02c482b7b10b67"},{"case_reference":"sim-dev-svc-02","category":"service-layout","fixture_sha256":"632ce396b4c84873b8e67f5917aa31faea7f72917db38723197edef2c3edfe85","partition":"synthetic-development","real_repository":false,"synthetic_identity":"6aa3d7022c95ebdbd310f088bb86bfa1197ce360ef6a82996129344d69089e0c"},{"case_reference":"a22a5a0fc5fec72be5020d502510f9a60d5ea4fed31a68028f3dcbc5c4b68a6d","category":"service-layout","fixture_sha256":"bfa8581058eb48ce74533b95485e65cd38826a70e93470320ac52ee9d8971266","partition":"synthetic-pseudo-holdout","real_repository":false,"synthetic_identity":"a233784a119035d7ef80ce21e1d4ea0b4debfb274c7f844c53f9ba93a01d359b"},{"case_reference":"b7acd08adc3caccf0bf51f6026e3b28a0fed6669132e3fd3c491b193128ef339","category":"service-layout","fixture_sha256":"d67490299acf7a74c8d29e3ced4cb3a46a946c763ebdb82009f0e94b6190ed11","partition":"synthetic-pseudo-holdout","real_repository":false,"synthetic_identity":"82ea91e73559336b2cc84daed04c5d53602a56a0f5cc8620f2e0d161fc7aa38e"},{"case_reference":"sim-dev-wsp-01","category":"workspace-layout","fixture_sha256":"f1968aba9fb813462d50ec1886a76ea8ebd4abc9a7c27c55258f13a54356d22a","partition":"synthetic-development","real_repository":false,"synthetic_identity":"8e1778e3e878d65f32746ef4219532d9bef84c2b0312031f092f625a297e821a"},{"case_reference":"sim-dev-wsp-02","category":"workspace-layout","fixture_sha256":"4d187c4377bfdbdc8e5904e65274215c8c8e9d49c93c4a37b77855e2c74fd323","partition":"synthetic-development","real_repository":false,"synthetic_identity":"ff6d6815121953d89b76f4864721f35af07be06cbde548478e45a6af32a5525b"},{"case_reference":"2b9b2bfe539797011d45aa272469337c782cdec6394f569f7728c0113679e26e","category":"workspace-layout","fixture_sha256":"b14cc143f80646c4591382bd0ad13b212ff43299fb10f280b20b75732a10bd8f","partition":"synthetic-pseudo-holdout","real_repository":false,"synthetic_identity":"2e5e300d94e676f37191a941e69d831434731f57d63a8931bf33d67ae094c2f9"},{"case_reference":"1e92b855804f6df897f67aa088bbb0d7404bea6953b685f9846ab4e624cfc509","category":"workspace-layout","fixture_sha256":"5c150b3ab95c016fdf4501807b266d802c4aab11ad29a08fd67f06f1442a2f63","partition":"synthetic-pseudo-holdout","real_repository":false,"synthetic_identity":"fbb29cd6de67de06dc40eed7b8da2888c86d754b2ce46c229e42f8546875eebd"},{"case_reference":"sim-dev-mdl-01","category":"model-layout","fixture_sha256":"0ce1b4bce4c83f00d5fb133c1a2a71453ba4feecce0ef5041a5f946b4f537278","partition":"synthetic-development","real_repository":false,"synthetic_identity":"ba5736df388cc7fead207d4b0d428caa5019833849e2ba072d49c412d47f4858"},{"case_reference":"sim-dev-mdl-02","category":"model-layout","fixture_sha256":"f1e269bb27465ba116503244fb452a61cf5abe5d12fd82ad2ce77acfc8ffa884","partition":"synthetic-development","real_repository":false,"synthetic_identity":"125a1a472ecc3c732ff25e8324e6edf8f43510be5e5d7768f8d649262e8ed785"},{"case_reference":"288ed95675fb65145e10f17fc6d94e2b310dec434af6e2196bc11b7cca8d61da","category":"model-layout","fixture_sha256":"0420f7b2edc21815c6b8366cc3f5b579321c650bc50c6099ba053ece3a41f83d","partition":"synthetic-pseudo-holdout","real_repository":false,"synthetic_identity":"e78b8d5828802f80bb56c0113b03d6212b484dbd22dd2e39a72d3bec220e1683"},{"case_reference":"5cb84c6259612369da58eebc5b2ffcd3824d970601bd7efe5b74b425bb68a725","category":"model-layout","fixture_sha256":"45d09c89e6133a52c1b84ab668fd3d14799327a5eca25e78b5e52a47038deb82","partition":"synthetic-pseudo-holdout","real_repository":false,"synthetic_identity":"3556ab9639a2e28c3d48ef907d62cfad747df753c4f457a52c63bb96779aca00"},{"case_reference":"sim-dev-web-01","category":"web-layout","fixture_sha256":"4b3b55c92d406ca6cdf537fdb46aa770079b9a62d88ed7638692918e749a1d0e","partition":"synthetic-development","real_repository":false,"synthetic_identity":"d20b39ca2f9fbc6c8d47b772e159bb1a9d1086a5102c179a913eb59624983fec"},{"case_reference":"sim-dev-web-02","category":"web-layout","fixture_sha256":"99d8d12454d38e1bb387dc07b42d4e74839c6cae570c5e5264a9a3f25c7b005a","partition":"synthetic-development","real_repository":false,"synthetic_identity":"f2fb2440309c12fb24011366e0363c332b2dfaa6edaf430d9e2be3a362466b50"},{"case_reference":"0c2489f41a7447876ace6568fd024c4866c759f9d401a2b247b7d2807004eb0f","category":"web-layout","fixture_sha256":"8e246011137d3f62852a3371f71dadd2fddd70c48b1f44e1feaf0d3bc8d2e1ef","partition":"synthetic-pseudo-holdout","real_repository":false,"synthetic_identity":"25a48840204d56aa6ae07a24728d38772547734c5f7327f1da4b95b79851f1df"},{"case_reference":"9803fd1753bc813b485faba3fe7583e290f50e533f978914c41674710a35bdd7","category":"web-layout","fixture_sha256":"1f08ee4e89060e623523eec7f2982e1cf917ddae5b7ee74eb34d8a3e62aa624a","partition":"synthetic-pseudo-holdout","real_repository":false,"synthetic_identity":"35328f90fa81c1ee259e91135da7adfef367dcdf2cca4968d5d5c4bb30289123"},{"case_reference":"sim-dev-cmd-01","category":"command-layout","fixture_sha256":"21333492e92ac7ddc4f22e8e42aef3c7f2b34e70b424f76bc8ec144db3ad53ce","partition":"synthetic-development","real_repository":false,"synthetic_identity":"15a6635e044666f4ba5dad621cacb9e722ced3bd389073a1a31a076a0c55cd1d"},{"case_reference":"sim-dev-cmd-02","category":"command-layout","fixture_sha256":"dda6f32e0a446b0f957428585ccf54e639816997a369629a7c3a89ce1ec3d1e0","partition":"synthetic-development","real_repository":false,"synthetic_identity":"c6898a7a04cb136847b68b96f4fdae8aacda48b563e03718d8e5d80df1d2deb0"},{"case_reference":"345951a465a263cf837f0ffe446ea44493731b53bc39a2d1b8070a5995eb7310","category":"command-layout","fixture_sha256":"00cef818d4d047da01e00d22b7a3293cc74d33cef4cf774cfafbe1da7501d1c3","partition":"synthetic-pseudo-holdout","real_repository":false,"synthetic_identity":"03d634f1aa8464fe4efd2af206dac75f56ccb56573035046a84ac65eda73ee53"},{"case_reference":"a8532afdf674a716a920cd1387c0299728d820b5c36f08fd24c5c79055b13ead","category":"command-layout","fixture_sha256":"42f13944a8191dbfec54b7a8b9544434df323739ac0d1e20df3aadbf682e0b91","partition":"synthetic-pseudo-holdout","real_repository":false,"synthetic_identity":"e2b36fca0056bd5d46220a4837b2a660ecf5de307ca1736ea08ce3a262448684"}],"category_count":5,"development_case_count":10,"population_sha256":"24eb6f9ce254baab89bec1fa288bf39a9470db49b2f4912818a5735dbea8fdbd","pseudo_holdout_case_count":10,"real_repository_identity_count":0},"producer":"SIM-CE","prospective_protocol_activated":false,"release_authority":false,"schema":"kanon-v1.0.0-simulation-artifact-v1","sequence":3,"simulated_status":"simulated","simulation":true}
